{
  "version": 1,
  "updated": "2026-10-27",
  "categories": [
    {
      "id": "launchers",
      "name": "Game launchers"
    },
    {
      "id": "compat",
      "name": "Compatibility tools"
    },
    {
      "id": "performance",
      "name": "Performance and tools"
    },
    {
      "id": "chat",
      "name": "Chat and community"
    },
    {
      "id": "recording",
      "name": "Recording and streaming"
    },
    {
      "id": "emulators",
      "name": "Emulators"
    },
    {
      "id": "peripherals",
      "name": "Peripherals"
    },
    {
      "id": "games",
      "name": "Free and open-source games"
    },
    {
      "id": "media",
      "name": "Media"
    },
    {
      "id": "system",
      "name": "System components"
    },
    {
      "id": "kernel",
      "name": "Kernel"
    }
  ],
  "presets": [
    {
      "id": "starter",
      "name": "Starter Pack",
      "summary": "A launcher for every store, Proton-GE, FPS overlay settings and Discord",
      "items": [
        "heroic",
        "lutris",
        "protonplus",
        "goverlay",
        "discord"
      ]
    },
    {
      "id": "streamer",
      "name": "Streamer",
      "summary": "The Starter Pack plus OBS and a low-overhead recorder",
      "items": [
        "heroic",
        "lutris",
        "protonplus",
        "goverlay",
        "discord",
        "obs",
        "gpu-screen-recorder"
      ]
    },
    {
      "id": "retro",
      "name": "Retro",
      "summary": "RetroArch, Dolphin, PCSX2 and PPSSPP",
      "items": [
        "retroarch",
        "dolphin",
        "pcsx2",
        "ppsspp"
      ]
    }
  ],
  "items": [
    {
      "id": "heroic",
      "name": "Heroic Games Launcher",
      "summary": "Epic Games, GOG and Amazon Prime Gaming library",
      "category": "launchers",
      "source": {
        "type": "flatpak",
        "remote": "flathub",
        "ref": "com.heroicgameslauncher.hgl"
      },
      "size_mb_estimate": 450,
      "starter_pack": true,
      "aliases": [
        "epic games",
        "epic",
        "gog",
        "amazon games"
      ],
      "requires": {
        "gpu": null,
        "arch": "x86_64"
      },
      "notes": null,
      "verified": "2026-10-27"
    },
    {
      "id": "lutris",
      "name": "Lutris",
      "summary": "Run games from many platforms with one launcher",
      "category": "launchers",
      "source": {
        "type": "flatpak",
        "remote": "flathub",
        "ref": "net.lutris.Lutris"
      },
      "size_mb_estimate": 700,
      "starter_pack": true,
      "aliases": [],
      "requires": {
        "gpu": null,
        "arch": "x86_64"
      },
      "notes": null,
      "verified": "2026-10-27"
    },
    {
      "id": "bottles",
      "name": "Bottles",
      "summary": "Run Windows software in separate bottles",
      "category": "launchers",
      "source": {
        "type": "flatpak",
        "remote": "flathub",
        "ref": "com.usebottles.bottles"
      },
      "size_mb_estimate": 600,
      "starter_pack": false,
      "aliases": [],
      "requires": {
        "gpu": null,
        "arch": "x86_64"
      },
      "notes": null,
      "verified": "2026-10-27"
    },
    {
      "id": "itch",
      "name": "itch",
      "summary": "The itch.io game store app",
      "category": "launchers",
      "source": {
        "type": "flatpak",
        "remote": "flathub",
        "ref": "io.itch.itch"
      },
      "size_mb_estimate": 250,
      "starter_pack": false,
      "aliases": [
        "itch.io"
      ],
      "requires": {
        "gpu": null,
        "arch": "x86_64"
      },
      "notes": null,
      "verified": "2026-10-27"
    },
    {
      "id": "minigalaxy",
      "name": "Minigalaxy",
      "summary": "Simple GOG library client",
      "category": "launchers",
      "source": {
        "type": "flatpak",
        "remote": "flathub",
        "ref": "io.github.sharkwouter.Minigalaxy"
      },
      "size_mb_estimate": 150,
      "starter_pack": false,
      "aliases": [
        "gog"
      ],
      "requires": {
        "gpu": null,
        "arch": "x86_64"
      },
      "notes": null,
      "verified": "2026-10-27"
    },
    {
      "id": "prism",
      "name": "Prism Launcher",
      "summary": "Manage Minecraft installations",
      "category": "launchers",
      "source": {
        "type": "flatpak",
        "remote": "flathub",
        "ref": "org.prismlauncher.PrismLauncher"
      },
      "size_mb_estimate": 300,
      "starter_pack": false,
      "aliases": [
        "minecraft"
      ],
      "requires": {
        "gpu": null,
        "arch": "x86_64"
      },
      "notes": null,
      "verified": "2026-10-27"
    },
    {
      "id": "protonplus",
      "name": "ProtonPlus",
      "summary": "Install Proton-GE, Wine-GE and other compatibility tools",
      "category": "compat",
      "source": {
        "type": "flatpak",
        "remote": "flathub",
        "ref": "com.vysp3r.ProtonPlus"
      },
      "size_mb_estimate": 120,
      "starter_pack": true,
      "aliases": [
        "proton ge",
        "proton-ge",
        "protonup",
        "wine ge"
      ],
      "requires": {
        "gpu": null,
        "arch": "x86_64"
      },
      "notes": null,
      "verified": "2026-10-27"
    },
    {
      "id": "protonup-qt",
      "name": "ProtonUp-Qt",
      "summary": "Another installer for Proton-GE and Wine-GE",
      "category": "compat",
      "source": {
        "type": "flatpak",
        "remote": "flathub",
        "ref": "net.davidotek.pupgui2"
      },
      "size_mb_estimate": 200,
      "starter_pack": false,
      "aliases": [],
      "requires": {
        "gpu": null,
        "arch": "x86_64"
      },
      "notes": null,
      "verified": "2026-10-27"
    },
    {
      "id": "mangohud-flatpak",
      "name": "MangoHud for Flatpak games",
      "summary": "Performance overlay layer for Flatpak games",
      "category": "compat",
      "source": {
        "type": "flatpak",
        "remote": "flathub",
        "ref": "org.freedesktop.Platform.VulkanLayer.MangoHud"
      },
      "size_mb_estimate": 30,
      "starter_pack": false,
      "aliases": [
        "mangohud flatpak"
      ],
      "requires": {
        "gpu": null,
        "arch": "x86_64"
      },
      "notes": "The version must match the runtime of the Flatpak game; Flatpak picks the newest.",
      "verified": "2026-10-27"
    },
    {
      "id": "gamescope-flatpak",
      "name": "Gamescope for Flatpak games",
      "summary": "Gamescope compositor layer for Flatpak games",
      "category": "compat",
      "source": {
        "type": "flatpak",
        "remote": "flathub",
        "ref": "org.freedesktop.Platform.VulkanLayer.gamescope"
      },
      "size_mb_estimate": 30,
      "starter_pack": false,
      "aliases": [],
      "requires": {
        "gpu": null,
        "arch": "x86_64"
      },
      "notes": "The version must match the runtime of the Flatpak game; Flatpak picks the newest.",
      "verified": "2026-10-27"
    },
    {
      "id": "goverlay",
      "name": "GOverlay",
      "summary": "Settings for the MangoHud performance overlay",
      "category": "performance",
      "source": {
        "type": "flatpak",
        "remote": "flathub",
        "ref": "io.github.benjamimgois.goverlay"
      },
      "size_mb_estimate": 150,
      "starter_pack": true,
      "aliases": [
        "mangohud settings"
      ],
      "requires": {
        "gpu": null,
        "arch": "x86_64"
      },
      "notes": null,
      "verified": "2026-10-27"
    },
    {
      "id": "lact",
      "name": "LACT",
      "summary": "Control and monitor AMD and NVIDIA graphics cards",
      "category": "performance",
      "source": {
        "type": "flatpak",
        "remote": "flathub",
        "ref": "io.github.ilya_zlobintsev.LACT"
      },
      "size_mb_estimate": 60,
      "starter_pack": false,
      "aliases": [
        "gpu control",
        "overclock"
      ],
      "requires": {
        "gpu": null,
        "arch": "x86_64"
      },
      "notes": "Can change fan speeds and clocks. Use with care.",
      "verified": "2026-10-27"
    },
    {
      "id": "mission-center",
      "name": "Mission Center",
      "summary": "System monitor with CPU, memory and GPU graphs",
      "category": "performance",
      "source": {
        "type": "flatpak",
        "remote": "flathub",
        "ref": "io.missioncenter.MissionCenter"
      },
      "size_mb_estimate": 90,
      "starter_pack": false,
      "aliases": [
        "task manager",
        "system monitor"
      ],
      "requires": {
        "gpu": null,
        "arch": "x86_64"
      },
      "notes": null,
      "verified": "2026-10-27"
    },
    {
      "id": "flatseal",
      "name": "Flatseal",
      "summary": "Review and change Flatpak app permissions",
      "category": "performance",
      "source": {
        "type": "flatpak",
        "remote": "flathub",
        "ref": "com.github.tchx84.Flatseal"
      },
      "size_mb_estimate": 10,
      "starter_pack": false,
      "aliases": [
        "flatpak permissions"
      ],
      "requires": {
        "gpu": null,
        "arch": "x86_64"
      },
      "notes": null,
      "verified": "2026-10-27"
    },
    {
      "id": "discord",
      "name": "Discord",
      "summary": "Voice and text chat",
      "category": "chat",
      "source": {
        "type": "flatpak",
        "remote": "flathub",
        "ref": "com.discordapp.Discord"
      },
      "size_mb_estimate": 180,
      "starter_pack": true,
      "aliases": [],
      "requires": {
        "gpu": null,
        "arch": "x86_64"
      },
      "notes": null,
      "verified": "2026-10-27"
    },
    {
      "id": "vesktop",
      "name": "Vesktop",
      "summary": "Discord client with better screen sharing on Wayland",
      "category": "chat",
      "source": {
        "type": "flatpak",
        "remote": "flathub",
        "ref": "dev.vencord.Vesktop"